index	pair_ID	pair_type	sentence_A	sentence_A_expRule	sentence_B	sentence_B_expRule	relatedness_score	entailment_label	entailment_AB	entailment_BA	sentence_A_original	sentence_B_original	sentence_A_dataset	sentence_B_dataset	SemEval_set	jpg
1357	7262	S1S4_inter	The man is doing a wheelie on a mountain bike	S1_null	A man is riding on a bicycle with one wheel only	S4_null	4.2	NEUTRAL	A_neutral_B	B_neutral_A	a man is doing a wheelie on a mountain bike	man on a bicycle riding on only one wheel	FLICKR	FLICKR	TRAIN	990890291_afc72be141.jpg#1
1361	7274	S1S1_inter	A brown duck with a green head is flapping its wings in the water	S1_null	A bird is flapping its wings on the water	S1_null	4.3	ENTAILMENT	A_entails_B	B_neutral_A	a brown duck with a green head flaps its wings in the water	a bird is flapping its wings on the water	FLICKR	FLICKR	TRAIN	3335501468_628655d608.jpg#1
1365	7294	S1S1_inter	A woman in a fur hat and fur coat is standing outside a building	S1_null	The elderly lady is waiting on the sidewalk	S1_null	2.5	NEUTRAL	A_neutral_B	B_neutral_A	a woman in a fur hat and fur coat stands outside a building	the elderly lady waits on the sidewalk	FLICKR	FLICKR	TRAIN	2307807200_91fa29cba1.jpg#3
1367	7292	S1S2_inter	The elderly lady is waiting on the sidewalk	S1_null	A lady in a fur hat and fur coat is standing outside a building	S2_null	3.4	NEUTRAL	A_neutral_B	B_neutral_A	the elderly lady waits on the sidewalk	a woman in a fur hat and fur coat stands outside a building	FLICKR	FLICKR	TRAIN	2307807200_91fa29cba1.jpg#4
1368	7293	S1S3_inter	The elderly lady is waiting on the sidewalk	S1_null	A woman in a fur hat and fur coat is sitting outside a building	S3_null	2.4	NEUTRAL	A_neutral_B	B_neutral_A	the elderly lady waits on the sidewalk	a woman in a fur hat and fur coat stands outside a building	FLICKR	FLICKR	TRAIN	2307807200_91fa29cba1.jpg#4
1372	7302	S1S3_inter	A young child is running outside over the fallen leaves	S1_null	A young child is lying down on a gravel road that is covered with dead leaves	S3_null	2.65	NEUTRAL	A_neutral_B	B_neutral_A	a young child runs outside amidst fall leaves	a young child runs down a gravel road covered with dead leaves	FLICKR	FLICKR	TRAIN	2571096893_694ce79768.jpg#2
1373	7304	S1S2_intra	The man in the straw hat is smoking a cigarette	S1_null	A cigarette is being smoked by the man in the straw hat	S2_top	5.0	ENTAILMENT	A_entails_B	B_entails_A	the man in the straw hat smokes a cigarette	the man in the straw hat smokes a cigarette	FLICKR	FLICKR	TRAIN	2861100960_457ceda7fa.jpg#3
1374	7309	S1S2_inter	The man in the straw hat is smoking a cigarette	S1_null	A person is wearing a straw hat and smoking a cigarette	S2_null	4.7	ENTAILMENT	A_entails_B	B_neutral_A	the man in the straw hat smokes a cigarette	a man wearing a straw hat smokes a cigarette	FLICKR	FLICKR	TRAIN	2861100960_457ceda7fa.jpg#3
1375	7314	S1S1_inter	A man is wearing a straw hat and smoking a cigarette	S1_null	The man in the straw hat is smoking a cigarette	S1_null	5.0	ENTAILMENT	A_entails_B	B_entails_A	the man in the straw hat smokes a cigarette	a man wearing a straw hat smokes a cigarette	FLICKR	FLICKR	TRAIN	2861100960_457ceda7fa.jpg#3
1377	7316	S1S3_intra	A man is wearing a blue checkered shirt and riding a unicycle in the street	S1_null	A man is standing shirtless in the street	S3_so	2.4	NEUTRAL	A_neutral_B	B_neutral_A	a man wearing a blue checkered shirt rides a unicycle in the street	a man wearing a blue checkered shirt rides a unicycle in the street	FLICKR	FLICKR	TRAIN	3705430840_e108de78bf.jpg#3
1378	7320	S1S3_inter	A man is wearing a blue checkered shirt and riding a unicycle in the street	S1_null	There is no man wearing a long sleeved blue shirt and jeans and riding a unicycle down a street	S3_null	3.5	CONTRADICTION	A_contradicts_B	B_contradicts_A	a man wearing a blue checkered shirt rides a unicycle in the street	a man wearing a long sleeved blue shirt and jeans is riding a unicycle down a street	FLICKR	FLICKR	TRAIN	3705430840_e108de78bf.jpg#3
1384	7334	S1S1_inter	Three men are staring at the big green hills in the distance	S1_null	Three men are looking into the distance	S1_null	4.3	ENTAILMENT	A_entails_B	B_neutral_A	three men are staring at the big, green hills in the distance	three man looking into the distance	FLICKR	FLICKR	TRAIN	3045613316_4e88862836.jpg#2
1390	7344	S1S3_inter	One man is climbing a rock wall and another man is holding a rope	S1_null	The men are not climbing a mountain	S3_null	3.0	NEUTRAL	A_neutral_B	B_neutral_A	one man is climbing a rock wall, while another man, below, holds a rope	two men climbing a mountain	FLICKR	FLICKR	TRAIN	405534893_2d0f3b0147.jpg#3
1391	7340	S1S2_inter	The men are climbing a mountain	S1_null	One man is climbing a wall made of rock and another man is holding a rope	S2_null	3.4	NEUTRAL	A_neutral_B	B_neutral_A	two men climbing a mountain	one man is climbing a rock wall, while another man, below, holds a rope	FLICKR	FLICKR	TRAIN	405534893_2d0f3b0147.jpg#4
1394	7346	S1S2_intra	Two children are playing on a statue	S1_null	Some children are playing on a statue	S2_det	4.3	ENTAILMENT	A_entails_B	B_neutral_A	two children playing on a statue	two children playing on a statue	FLICKR	FLICKR	TRAIN	1428681303_04213524e3.jpg#3
1395	7347	S1S3_intra	Two children are playing on a statue	S1_null	There are no children playing on a statue	S3_od	4.1	CONTRADICTION	A_contradicts_B	B_contradicts_A	two children playing on a statue	two children playing on a statue	FLICKR	FLICKR	TRAIN	1428681303_04213524e3.jpg#3
1397	7353	S1S4_inter	Two children are playing on a statue	S1_null	A climber is parking with the children by a small statue	S4_null	3.2	NEUTRAL	A_neutral_B	B_neutral_A	two children playing on a statue	small children climb a statue in a park	FLICKR	FLICKR	TRAIN	1428681303_04213524e3.jpg#3
1400	7358	S1S3_intra	A blonde lady is looking at a tower	S1_null	There is no blonde lady looking at a tower	S3_od	4.0	CONTRADICTION	A_contradicts_B	B_contradicts_A	blonde lady looks at space needle	blonde lady looks at space needle	FLICKR	FLICKR	TRAIN	524105255_b346f288be.jpg#3
1402	7364	S1S3_inter	A woman is looking at the view of a city	S1_null	There is no blonde lady looking at a tower	S3_null	3.7	NEUTRAL	A_neutral_B	B_neutral_A	blonde lady looks at space needle	a woman looking at view of a city	FLICKR	FLICKR	TRAIN	524105255_b346f288be.jpg#3
1403	7365	S1S1_inter	A blonde lady is looking at a tower	S1_null	A woman is looking at the view of a city	S1_null	2.8	NEUTRAL	A_neutral_B	B_neutral_A	blonde lady looks at space needle	a woman looking at view of a city	FLICKR	FLICKR	TRAIN	524105255_b346f288be.jpg#3
1404	7359	S1S2_intra	A woman is looking at the view of a city	S1_null	The woman is looking at the view of a city	S2_aa	4.9	ENTAILMENT	A_entails_B	B_entails_A	a woman looking at view of a city	a woman looking at view of a city	FLICKR	FLICKR	TRAIN	524105255_b346f288be.jpg#2
1405	9856	unrel	A cat is playing with a watermelon	S1_null	A woman is looking at the view of a city	S1_null	1.0	NEUTRAL	A_neutral_B	B_neutral_A	a woman looking at view of a city	a cat is playing with a watermelon	FLICKR	SEMEVAL	TRAIN	524105255_b346f288be.jpg#2
1407	7371	S1S2_inter	A person is standing on a mountain top	S1_null	One man is standing on the top of the rocks with clouds behind them	S2_null	3.7	NEUTRAL	A_neutral_B	B_neutral_A	a person stands on a mountain top	a man at the top of rocks, clouds behind	FLICKR	FLICKR	TRAIN	2644920808_f5a214b744.jpg#4
1409	7368	S1S2_intra	A man is standing on the top of the rocks with clouds behind them	S1_null	One man is standing on the top of the rocks with clouds behind them	S2_det	4.7	ENTAILMENT	A_entails_B	B_entails_A	a man at the top of rocks, clouds behind	a man at the top of rocks, clouds behind	FLICKR	FLICKR	TRAIN	2644920808_f5a214b744.jpg#0
1411	7370	S1S4_intra	A man is standing on the top of the rocks with clouds behind them	S1_null	A man is standing behind the rocks with clouds on top of them	S4_ws	3.5	NEUTRAL	A_neutral_B	B_neutral_A	a man at the top of rocks, clouds behind	a man at the top of rocks, clouds behind	FLICKR	FLICKR	TRAIN	2644920808_f5a214b744.jpg#0
1413	7375	S1S3_inter	A man is standing on the top of the rocks with clouds behind them	S1_null	A person is sitting on a mountain top	S3_null	3.4	NEUTRAL	A_neutral_B	B_neutral_A	a man at the top of rocks, clouds behind	a person stands on a mountain top	FLICKR	FLICKR	TRAIN	2644920808_f5a214b744.jpg#0
1414	7381	S1S2_inter	A smiling boy in winter clothes is waving his mittened hands outside a building in the snow	S1_null	A child, who is young, dressed for cold weather, is standing outside	S2_null	3.9	NEUTRAL	A_neutral_B	B_neutral_A	a smiling boy in winter clothes waves his mittened hands outside a building in the snow	a young child dressed for cold weather is outside	FLICKR	FLICKR	TRAIN	2171576939_d1e72daab2.jpg#2
1416	9864	unrel	A large dog and a small dog are standing next to the kitchen counter and are investigating	S1_null	A smiling boy in winter clothes is waving his mittened hands outside a building in the snow	S1_null	1.0	NEUTRAL	A_neutral_B	B_neutral_A	a smiling boy in winter clothes waves his mittened hands outside a building in the snow	a large dog and a small dog stand next to the kitchen counter to investigate	FLICKR	FLICKR	TRAIN	2171576939_d1e72daab2.jpg#2
1417	7383	S1S2_inter	A young child dressed for cold weather is standing outside	S1_null	The smiling boy in winter clothes is waving his mittened hands outside the building in the snow	S2_null	3.2	NEUTRAL	A_neutral_B	B_neutral_A	a young child dressed for cold weather is outside	a smiling boy in winter clothes waves his mittened hands outside a building in the snow	FLICKR	FLICKR	TRAIN	2171576939_d1e72daab2.jpg#3
1418	7389	S1S3_intra	A child is swimming underwater in a pool	S1_null	A child is swimming on the water's surface in a pool	S3_so	3.2	NEUTRAL	A_neutral_B	B_neutral_A	a child swims underwater in a pool	a child swims underwater in a pool	FLICKR	FLICKR	TRAIN	2775744946_1ab5d500a2.jpg#2
1419	7392	S1S2_inter	A child is swimming underwater in a pool	S1_null	A kid is smiling at the camera and swimming underwater	S2_null	4.0	NEUTRAL	A_neutral_B	B_neutral_A	a child swims underwater in a pool	a child smiling at the camera while swimming underwater	FLICKR	FLICKR	TRAIN	2775744946_1ab5d500a2.jpg#2
1420	7391	S1S3_inter	A child is smiling at the camera and swimming underwater	S1_null	A child is swimming on the water's surface in a pool	S3_null	3.1	NEUTRAL	A_contradicts_B	B_neutral_A	a child smiling at the camera while swimming underwater	a child swims underwater in a pool	FLICKR	FLICKR	TRAIN	2775744946_1ab5d500a2.jpg#1
1424	7399	S1S2_inter	A man and a child are kayaking through gentle waters	S1_null	A yellow kayak is being ridden by a man and a young boy	S2_null	4.4	NEUTRAL	A_neutral_B	B_neutral_A	a man and child kayak through gentle waters	a man and young boy ride in a yellow kayak	FLICKR	FLICKR	TRAIN	1028205764_7e8df9a2ea.jpg#2
1426	7398	S1S3_intra	A man and a young boy are riding in a yellow kayak	S1_null	A man and a young boy are jumping off of a yellow kayak	S3_so	3.6	NEUTRAL	A_neutral_B	B_neutral_A	a man and young boy ride in a yellow kayak	a man and young boy ride in a yellow kayak	FLICKR	FLICKR	TRAIN	1028205764_7e8df9a2ea.jpg#3
1431	7418	S1S2_inter	A dog is chasing a ball in the grass	S1_null	A ball is being chased by a dog on the grass	S2_null	4.7	ENTAILMENT	A_entails_B	B_entails_A	a dog chases a nerf ball in the grass	dog chasing after a ball on the grass	FLICKR	FLICKR	TRAIN	3561433412_3985208d53.jpg#0
1432	7419	S1S3_inter	A dog is chasing a ball in the grass	S1_null	A dog is losing a ball on the grass	S3_null	4.1	NEUTRAL	A_neutral_B	B_neutral_A	a dog chases a nerf ball in the grass	dog chasing after a ball on the grass	FLICKR	FLICKR	TRAIN	3561433412_3985208d53.jpg#0
1433	7423	S1S1_inter	A dog is chasing a ball on the grass	S1_null	A dog is chasing a ball in the grass	S1_null	4.9	ENTAILMENT	A_entails_B	B_entails_A	a dog chases a nerf ball in the grass	dog chasing after a ball on the grass	FLICKR	FLICKR	TRAIN	3561433412_3985208d53.jpg#0
1434	7416	S1S2_intra	A dog is chasing a ball on the grass	S1_null	A ball is being chased by a dog on the grass	S2_top	4.9	ENTAILMENT	A_entails_B	B_entails_A	dog chasing after a ball on the grass	dog chasing after a ball on the grass	FLICKR	FLICKR	TRAIN	3561433412_3985208d53.jpg#3
1435	7417	S1S3_intra	A dog is chasing a ball on the grass	S1_null	A dog is losing a ball on the grass	S3_so	3.7	NEUTRAL	A_neutral_B	B_neutral_A	dog chasing after a ball on the grass	dog chasing after a ball on the grass	FLICKR	FLICKR	TRAIN	3561433412_3985208d53.jpg#3
1438	7427	S1S3_intra	A tan dog is jumping up and catching a tennis ball	S1_null	There is no tan dog jumping up and catching a tennis ball	S3_od	3.3	CONTRADICTION	A_contradicts_B	B_contradicts_A	a tan dog jumps up to catch a tennis ball	a tan dog jumps up to catch a tennis ball	FLICKR	FLICKR	TRAIN	2053777548_108e54c826.jpg#3
1440	7428	S1S2_inter	A red dog is jumping and catching a tennis ball in its mouth	S1_null	A dog with a tan coat is jumping up and catching a tennis ball	S2_null	3.7	NEUTRAL	A_neutral_B	B_neutral_A	a red dog jumps an catches a tennis ball in its mouth	a tan dog jumps up to catch a tennis ball	FLICKR	FLICKR	TRAIN	2053777548_108e54c826.jpg#1
1441	7432	S1S1_inter	A red dog is jumping and catching a tennis ball in its mouth	S1_null	A tan dog is jumping up and catching a tennis ball	S1_null	3.9	NEUTRAL	A_neutral_B	B_neutral_A	a red dog jumps an catches a tennis ball in its mouth	a tan dog jumps up to catch a tennis ball	FLICKR	FLICKR	TRAIN	2053777548_108e54c826.jpg#1
1443	7434	S1S3_intra	A man is sitting on a train and resting his hand against his face	S1_null	A man is standing on a train and resting his hand on his lap	S3_so	3.4	NEUTRAL	A_neutral_B	B_neutral_A	a man is sitting on a train resting his hand against his face	a man is sitting on a train resting his hand against his face	FLICKR	FLICKR	TRAIN	2985679744_75a7102aab.jpg#1
1444	7437	S1S2_inter	A man is sitting on a train and resting his hand against his face	S1_null	The hairy man is sitting on a train	S2_null	3.2	NEUTRAL	A_neutral_B	B_neutral_A	a man is sitting on a train resting his hand against his face	a bearded man on a train	FLICKR	FLICKR	TRAIN	2985679744_75a7102aab.jpg#1
1445	7438	S1S3_inter	A man is sitting on a train and resting his hand against his face	S1_null	The bearded man is not sitting on a train	S3_null	2.1	NEUTRAL	A_neutral_B	B_neutral_A	a man is sitting on a train resting his hand against his face	a bearded man on a train	FLICKR	FLICKR	TRAIN	2985679744_75a7102aab.jpg#1
1446	7441	S1S1_inter	A man is sitting on a train and resting his hand against his face	S1_null	The bearded man is sitting on a train	S1_null	3.8	NEUTRAL	A_neutral_B	B_neutral_A	a man is sitting on a train resting his hand against his face	a bearded man on a train	FLICKR	FLICKR	TRAIN	2985679744_75a7102aab.jpg#1
1453	7454	S1S1_inter	The little girl is swinging and the woman is standing behind her	S1_null	A small child is showing excitement on a swing set at the park	S1_null	2.9	NEUTRAL	A_neutral_B	B_neutral_A	a small child shows excitement on a swing set at the park	a little girl swings, a woman stands behind her	FLICKR	FLICKR	TRAIN	2977246776_b14be8290d.jpg#2
1457	7455	S1S2_intra	A man is performing a trick on a surfboard in the water	S1_null	A person is performing a trick on a surfboard in the water	S2_lex	4.8	ENTAILMENT	A_entails_B	B_neutral_A	a man performs a trick on a surfboard in the water	a man performs a trick on a surfboard in the water	FLICKR	FLICKR	TRAIN	3073535022_4af81f360c.jpg#0
1461	7468	S1S4_intra	The group of people is sitting in a dim room	S1_null	The group of dim people is sitting in a room	S4_ws	3.5	NEUTRAL	A_neutral_B	B_neutral_A	a group of people in a dim room	a group of people in a dim room	FLICKR	FLICKR	TRAIN	3266399073_40820596d5.jpg#0
1462	7476	S1S1_inter	A man and two women in a darkened room are sitting at a table with candles	S1_null	The group of people is sitting in a dim room	S1_null	3.7	ENTAILMENT	A_entails_B	B_neutral_A	a group of people in a dim room	a man and two women sit in a darkened room at a table with candles	FLICKR	FLICKR	TRAIN	3266399073_40820596d5.jpg#0
1464	7474	S1S3_inter	A man and two women in a darkened room are sitting at a table with candles	S1_null	The group of people is not sitting in a dim room	S3_null	3.8	CONTRADICTION	A_contradicts_B	B_contradicts_A	a man and two women sit in a darkened room at a table with candles	a group of people in a dim room	FLICKR	FLICKR	TRAIN	3266399073_40820596d5.jpg#1
1468	7485	S1S1_inter	Two guys are sitting around a table and holding beers in their hands	S1_null	A man in a white shirt and sunglasses and a man in a black shirt and sunglasses are sitting at a table with four beer bottles	S1_null	4.1	NEUTRAL	A_neutral_B	B_neutral_A	a man in a white shirt and sunglasses and a man in a black shirt and sunglasses sit at a table with four beer bottles	there are two guys sitting around a table, both with beers in their hands	FLICKR	FLICKR	TRAIN	3416339125_0860d3d1eb.jpg#0
1469	7479	S1S2_intra	Two guys are sitting around a table and holding beers in their hands	S1_null	Two blokes are sitting around a table and holding beers in their hands	S2_lex	4.6	ENTAILMENT	A_entails_B	B_entails_A	there are two guys sitting around a table, both with beers in their hands	there are two guys sitting around a table, both with beers in their hands	FLICKR	FLICKR	TRAIN	3416339125_0860d3d1eb.jpg#1
1470	7483	S1S2_inter	Two guys are sitting around a table and holding beers in their hands	S1_null	A man in a white shirt and sunglasses and a man in a black shirt and sunglasses are sitting at a table with four bottles of beer	S2_null	3.8	NEUTRAL	A_neutral_B	B_neutral_A	there are two guys sitting around a table, both with beers in their hands	a man in a white shirt and sunglasses and a man in a black shirt and sunglasses sit at a table with four beer bottles	FLICKR	FLICKR	TRAIN	3416339125_0860d3d1eb.jpg#1
1472	7487	S1S3_intra	A dog is chasing a ball	S1_null	There is no dog chasing a ball	S3_od	3.6	CONTRADICTION	A_contradicts_B	B_contradicts_A	a dog chasing a ball	a dog chasing a ball	FLICKR	FLICKR	TRAIN	2483993772_f64e9e4724.jpg#1
1474	7491	S1S3_inter	A dog is chasing a ball	S1_null	The dog is not catching a blue ball	S3_null	3.4	NEUTRAL	A_neutral_B	B_neutral_A	a dog chasing a ball	the german shepherd dog is trying to catch a blue ball	FLICKR	FLICKR	TRAIN	2483993772_f64e9e4724.jpg#1
1475	7492	S1S2_inter	The dog is catching a blue ball	S1_null	The dog is chasing the ball	S2_null	3.8	NEUTRAL	A_neutral_B	B_neutral_A	a dog chasing a ball	the german shepherd dog is trying to catch a blue ball	FLICKR	FLICKR	TRAIN	2483993772_f64e9e4724.jpg#1
1479	7505	S1S1_inter	A person is wearing a red jacket and holding a beer	S1_null	The woman is wearing a red jacket and holding a glass in front of the man in a white t-shirt	S1_null	3.3	NEUTRAL	A_neutral_B	B_neutral_A	a person wearing a red jacket holds a beer while a man in a white shirt follows	the woman wearing a red jacket is holding a glass and she is in front of the man in a white tee shirt	FLICKR	FLICKR	TRAIN	3652859271_908ae0ae89.jpg#0
1480	7506	S1S2_intra	Two brown dogs are playing with a frisbee in the water	S1_null	Two brown dogs are playing with the frisbee in the water	S2_det	4.9	ENTAILMENT	A_entails_B	B_entails_A	two brown dogs play with a frisbee in the water	two brown dogs play with a frisbee in the water	FLICKR	FLICKR	TRAIN	2632381125_de32bdfdf6.jpg#0
1481	7507	S1S3_intra	Two brown dogs are playing with a frisbee in the water	S1_null	Two brown dogs are leaving a frisbee in the water	S3_so	3.8	NEUTRAL	A_neutral_B	B_neutral_A	two brown dogs play with a frisbee in the water	two brown dogs play with a frisbee in the water	FLICKR	FLICKR	TRAIN	2632381125_de32bdfdf6.jpg#0
1485	7516	S1S3_intra	A girl in pink is twirling a ribbon	S1_null	There is no girl in pink twirling a ribbon	S3_od	4.3	CONTRADICTION	A_contradicts_B	B_contradicts_A	a girl in pink twirls a ribbon	a girl in pink twirls a ribbon	FLICKR	FLICKR	TRAIN	1516714577_7d1c35a8d8.jpg#0
1491	7534	S1S1_inter	A child is playing with a water spout outdoors and the rest of his family is watching	S1_null	A boy is holding a hose next to a man and another boy is watching	S1_null	3.6	NEUTRAL	A_neutral_B	B_neutral_A	a child is playing with a water spout outdoors while the rest of his family watches	a boy holding a hose next to a man while another boy watches on, held by a woman	FLICKR	FLICKR	TRAIN	2055646179_169807fed4.jpg#1
1492	9893	unrel	A child is playing with a water spout outdoors and the rest of his family is watching	S1_null	A man is standing beside a birdcage which is large and colorful	S2_null	1.4	NEUTRAL	A_neutral_B	B_neutral_A	a child is playing with a water spout outdoors while the rest of his family watches	a man is standing beside a large, colorful birdcage containing birds	FLICKR	FLICKR	TRAIN	2055646179_169807fed4.jpg#1
1494	7537	S1S4_intra	A football player is running past an official carrying a football	S1_null	A football player is carrying an official past a rolling football	S4_ws	4.1	NEUTRAL	A_neutral_B	B_contradicts_A	a football player runs past an official carrying a football	a football player runs past an official carrying a football	FLICKR	FLICKR	TRAIN	2973272684_4d63cbc241.jpg#3
1495	7545	S1S1_inter	A football player in a purple jersey is running with the ball for a touchdown	S1_null	A football player is running past an official carrying a football	S1_null	3.5	NEUTRAL	A_neutral_B	B_neutral_A	a football player runs past an official carrying a football	a football player in a purple jersey is running the ball in for a touchdown	FLICKR	FLICKR	TRAIN	2973272684_4d63cbc241.jpg#3
1496	7539	S1S3_intra	A football player in a purple jersey is running with the ball for a touchdown	S1_null	There is no football player in a purple jersey running with the ball for a touchdown	S3_od	4.3	CONTRADICTION	A_contradicts_B	B_contradicts_A	a football player in a purple jersey is running the ball in for a touchdown	a football player in a purple jersey is running the ball in for a touchdown	FLICKR	FLICKR	TRAIN	2973272684_4d63cbc241.jpg#1
1497	7542	S1S2_inter	A football player in a purple jersey is running with the ball for a touchdown	S1_null	A person playing football is running past an official carrying a football	S2_null	4.1	NEUTRAL	A_neutral_B	B_neutral_A	a football player in a purple jersey is running the ball in for a touchdown	a football player runs past an official carrying a football	FLICKR	FLICKR	TRAIN	2973272684_4d63cbc241.jpg#1
1498	7543	S1S3_inter	A football player in a purple jersey is running with the ball for a touchdown	S1_null	A football player is running into an official carrying a football	S3_null	3.8	NEUTRAL	A_neutral_B	B_neutral_A	a football player in a purple jersey is running the ball in for a touchdown	a football player runs past an official carrying a football	FLICKR	FLICKR	TRAIN	2973272684_4d63cbc241.jpg#1
1500	7550	S1S2_inter	A young girl in a blue leotard is jumping in the air	S1_null	The young girl in blue is jumping in the air	S2_null	4.3	ENTAILMENT	A_entails_B	B_neutral_A	a young girl wearing a blue leotard jumps in the air	a young girl wearing blue is jumping in the air	FLICKR	FLICKR	TRAIN	2574084102_f2be3f73cb.jpg#3
1501	7551	S1S3_inter	A young girl in a blue leotard is jumping in the air	S1_null	There is no girl in blue jumping in the air	S3_null	3.3	CONTRADICTION	A_contradicts_B	B_contradicts_A	a young girl wearing a blue leotard jumps in the air	a young girl wearing blue is jumping in the air	FLICKR	FLICKR	TRAIN	2574084102_f2be3f73cb.jpg#3
1502	7554	S1S1_inter	A young girl in a blue leotard is jumping in the air	S1_null	A young girl in blue is jumping in the air	S1_null	4.2	ENTAILMENT	A_entails_B	B_neutral_A	a young girl wearing a blue leotard jumps in the air	a young girl wearing blue is jumping in the air	FLICKR	FLICKR	TRAIN	2574084102_f2be3f73cb.jpg#3
1503	7549	S1S3_intra	A young girl in blue is jumping in the air	S1_null	There is no girl in blue jumping in the air	S3_od	3.7	CONTRADICTION	A_contradicts_B	B_contradicts_A	a young girl wearing blue is jumping in the air	a young girl wearing blue is jumping in the air	FLICKR	FLICKR	TRAIN	2574084102_f2be3f73cb.jpg#4
1504	7553	S1S3_inter	A young girl in blue is jumping in the air	S1_null	A young girl in a blue leotard is jumping on the ground	S3_null	3.8	NEUTRAL	A_neutral_B	B_neutral_A	a young girl wearing blue is jumping in the air	a young girl wearing a blue leotard jumps in the air	FLICKR	FLICKR	TRAIN	2574084102_f2be3f73cb.jpg#4
1505	7556	S1S3_intra	A little boy is sitting in a green tunnel with a smile on his face	S1_null	A little boy is crawling in a green tunnel with a smile on his face	S3_so	4.6	NEUTRAL	A_neutral_B	B_neutral_A	little boy sitting in a green tunnel with a smile on his face	little boy sitting in a green tunnel with a smile on his face	FLICKR	FLICKR	TRAIN	3457455611_94ee93929f.jpg#3
1507	7561	S1S3_inter	A little boy is sitting in a green tunnel with a smile on his face	S1_null	A small shirtless boy is sliding into a green tube	S3_null	3.0	NEUTRAL	A_neutral_B	B_neutral_A	little boy sitting in a green tunnel with a smile on his face	small boy in striped shirt sliding out of green tube	FLICKR	FLICKR	TRAIN	3457455611_94ee93929f.jpg#3
1510	7557	S1S2_intra	A small boy in a striped shirt is sliding out of a green tube	S1_null	A little boy in a striped shirt is sliding out of a green tube	S2_lex	4.9	ENTAILMENT	A_entails_B	B_entails_A	small boy in striped shirt sliding out of green tube	small boy in striped shirt sliding out of green tube	FLICKR	FLICKR	TRAIN	3457455611_94ee93929f.jpg#4
