index	pair_ID	pair_type	sentence_A	sentence_A_expRule	sentence_B	sentence_B_expRule	relatedness_score	entailment_label	entailment_AB	entailment_BA	sentence_A_original	sentence_B_original	sentence_A_dataset	sentence_B_dataset	SemEval_set	jpg
2022	8441	S1S1_inter	A child is playing slip and slide in the grass	S1_null	A child is splashing in a pool for children and other children are playing in the background	S1_null	2.6	NEUTRAL	A_neutral_B	B_neutral_A	a child is playing on a slip and slide game in the grass	a child is splashing in a children's pool while other children are playing in the background	FLICKR	FLICKR	TRAIN	2537197415_af7c30dfc8.jpg#1
2026	8446	S1S2_inter	Two men are standing together and one is looking through binoculars	S1_null	Two men are looking out and binoculars are being held by one of them	S2_null	4.0	ENTAILMENT	A_entails_B	B_neutral_A	two men are standing together while one looks through binoculars	two men look out as one is holding binoculars	FLICKR	FLICKR	TRAIN	2096771662_984441d20d.jpg#2
2029	8452	S1S3_intra	A motorcyclist on a bike is leaning into a sharp corner	S1_null	There is no motorcyclist on a bike leaning into a sharp corner	S3_od	3.2	CONTRADICTION	A_contradicts_B	B_contradicts_A	a motorcyclist on a number 52 bike leans in for a sharp turn	a motorcyclist on a number 52 bike leans in for a sharp turn	FLICKR	FLICKR	TRAIN	2489602993_896c1ea40a.jpg#3
2030	8455	S1S2_inter	A motorcyclist on a bike is leaning into a sharp corner	S1_null	A man on a motorcycle is turning around a corner	S2_null	4.5	ENTAILMENT	A_entails_B	B_neutral_A	a motorcyclist on a number 52 bike leans in for a sharp turn	a man on a motorcycle going around a corner	FLICKR	FLICKR	TRAIN	2489602993_896c1ea40a.jpg#3
2031	8456	S1S3_inter	A motorcyclist on a bike is leaning into a sharp corner	S1_null	A woman on a motorcycle is going around a corner	S3_null	4.0	NEUTRAL	A_neutral_B	B_neutral_A	a motorcyclist on a number 52 bike leans in for a sharp turn	a man on a motorcycle going around a corner	FLICKR	FLICKR	TRAIN	2489602993_896c1ea40a.jpg#3
2032	8459	S1S1_inter	A man on a motorcycle is going around a corner	S1_null	A motorcyclist on a bike is leaning into a sharp corner	S1_null	4.0	NEUTRAL	A_neutral_B	B_neutral_A	a motorcyclist on a number 52 bike leans in for a sharp turn	a man on a motorcycle going around a corner	FLICKR	FLICKR	TRAIN	2489602993_896c1ea40a.jpg#3
2034	8458	S1S3_inter	A man on a motorcycle is going around a corner	S1_null	There is no motorcyclist on a bike leaning into a sharp corner	S3_null	3.9	CONTRADICTION	A_contradicts_B	B_contradicts_A	a man on a motorcycle going around a corner	a motorcyclist on a number 52 bike leans in for a sharp turn	FLICKR	FLICKR	TRAIN	2489602993_896c1ea40a.jpg#0
2035	8460	S1S2_intra	A man with a backwards hat is sitting on the ground	S1_null	A person with a backwards hat is sitting on the ground	S2_lex	4.6	ENTAILMENT	A_entails_B	B_neutral_A	a man with a backwards hat sits on the ground	a man with a backwards hat sits on the ground	FLICKR	FLICKR	TRAIN	2268601066_b018b124fd.jpg#1
2038	8462	S1S2_intra	A young man in a white shirt and gold and black hat is sitting with crossed legs	S1_null	A young person in a white shirt and gold and black hat is sitting with crossed legs	S2_lex	4.7	ENTAILMENT	A_entails_B	B_neutral_A	a young man in a white shirt and gold and black hat sits cross legged	a young man in a white shirt and gold and black hat sits cross legged	FLICKR	FLICKR	TRAIN	2268601066_b018b124fd.jpg#3
2040	8469	S1S2_intra	A young oriental girl is standing above the crowd and is playing with a pinwheel	S1_null	A young oriental girl is standing above people and is playing with a pinwheel	S2_lex	4.7	ENTAILMENT	A_entails_B	B_neutral_A	a young oriential girl is standing above the crowd playing with a pinwheel	a young oriential girl is standing above the crowd playing with a pinwheel	FLICKR	FLICKR	TRAIN	2666205903_8d287669e1.jpg#3
2042	8474	S1S3_inter	A young oriental girl is standing above the crowd and is playing with a pinwheel	S1_null	A girl in blue sweater is holding a multicolor toy and is sitting on the shoulders of a woman with grey hair	S3_null	2.6	NEUTRAL	A_neutral_B	B_neutral_A	a young oriential girl is standing above the crowd playing with a pinwheel	girl in blue sweater and holding a multicolor toy sitting on the shoulders of a man with grey hair	FLICKR	FLICKR	TRAIN	2666205903_8d287669e1.jpg#3
2045	8475	S1S2_inter	A girl in blue sweater is holding a multicolor toy and is sitting on the shoulders of a man with grey hair	S1_null	A young oriental girl is standing above people and is playing with a pinwheel	S2_null	2.4	NEUTRAL	A_neutral_B	B_neutral_A	girl in blue sweater and holding a multicolor toy sitting on the shoulders of a man with grey hair	a young oriential girl is standing above the crowd playing with a pinwheel	FLICKR	FLICKR	TRAIN	2666205903_8d287669e1.jpg#4
2047	8482	S1S2_inter	A young man on a bmx bicycle is jumping off a masonry pyramid	S1_null	A man on a bike is jumping on a pyramid-shaped ramp	S2_null	4.0	NEUTRAL	A_neutral_B	B_neutral_A	young man on a trick bicycle jumping off a masonry pyramid	a bicyclist is jumping on a pyramid-shaped ramp	FLICKR	FLICKR	TRAIN	2909811789_ed8f3fd972.jpg#4
2048	8486	S1S1_inter	A bicyclist is jumping on a pyramid-shaped ramp	S1_null	A young man on a bmx bicycle is jumping off a masonry pyramid	S1_null	4.2	ENTAILMENT	A_entails_B	B_neutral_A	young man on a trick bicycle jumping off a masonry pyramid	a bicyclist is jumping on a pyramid-shaped ramp	FLICKR	FLICKR	TRAIN	2909811789_ed8f3fd972.jpg#4
2052	8489	S1S2_intra	A man with no shirt is holding a football	S1_null	A football is being held by a man with no shirt	S2_top	5.0	ENTAILMENT	A_entails_B	B_entails_A	a man with no shirt on is holding a football	a man with no shirt on is holding a football	FLICKR	FLICKR	TRAIN	2681215810_00b0642f7b.jpg#1
2053	8494	S1S3_inter	A man with no shirt is holding a football	S1_null	A shirtless man is playing football in a gym	S3_null	4.0	NEUTRAL	A_neutral_B	B_neutral_A	a man with no shirt on is holding a football	a shirtless man playing football on a lawn	FLICKR	FLICKR	TRAIN	2681215810_00b0642f7b.jpg#1
2057	8504	S1S1_inter	The man is going into the water	S1_null	The person is going into the water	S1_null	4.5	ENTAILMENT	A_entails_B	B_neutral_A	the man is going into the water	the person is going into the water	FLICKR	FLICKR	TRAIN	3667492609_97f88b373f.jpg#3
2060	8506	S1S3_intra	Two people are sitting on a park bench on a sunny day	S1_null	Two people are sitting on a park bench on a rainy day	S3_so	3.2	NEUTRAL	A_neutral_B	B_contradicts_A	two people sitting on a park bench on a sunny day	two people sitting on a park bench on a sunny day	FLICKR	FLICKR	TRAIN	3608567609_aae96d4a5e.jpg#2
2064	8512	S1S3_inter	Two women dressed in white and black are sitting on a bench	S1_null	Two people are sitting on a park bench on a rainy day	S3_null	3.9	NEUTRAL	A_neutral_B	B_neutral_A	two women, one in white, one in black, are sitting on a bench	two people sitting on a park bench on a sunny day	FLICKR	FLICKR	TRAIN	3608567609_aae96d4a5e.jpg#4
2065	8514	S1S2_intra	Five people are standing in the grass with three dogs	S1_null	Five people are standing in the grass with some dogs	S2_det	4.4	ENTAILMENT	A_entails_B	B_neutral_A	five people stand in the grass with three dogs	five people stand in the grass with three dogs	FLICKR	FLICKR	TRAIN	3047144646_2252ff8e04.jpg#3
2068	8516	S1S2_intra	Five people are standing with three dogs in the green field beside the road	S1_null	Five people are standing with three dogs in the park beside the road	S2_lex	4.3	NEUTRAL	A_neutral_B	B_neutral_A	five people are standing with three dogs in the green field beside the road	five people are standing with three dogs in the green field beside the road	FLICKR	FLICKR	TRAIN	3047144646_2252ff8e04.jpg#2
2069	8520	S1S2_inter	Five people are standing with three dogs in the green field beside the road	S1_null	Five people are standing in the grass with some dogs	S2_null	4.4	ENTAILMENT	A_entails_B	B_neutral_A	five people are standing with three dogs in the green field beside the road	five people stand in the grass with three dogs	FLICKR	FLICKR	TRAIN	3047144646_2252ff8e04.jpg#2
2072	8529	S1S2_inter	A girl in gold and purple is holding a rainbow afghan	S1_null	A girl is carrying a lot of colorful scarves on the beach	S2_null	2.3	NEUTRAL	A_neutral_B	B_neutral_A	a girl in gold and purple is holding a rainbow afghan	a young woman carries a lot of colorful scarves on the beach	FLICKR	FLICKR	TRAIN	318070878_92ead85868.jpg#1
2075	8532	S1S2_intra	A light brown dog is running in the water	S1_null	A light brown dog is sprinting in the water	S2_lex	4.7	ENTAILMENT	A_entails_B	B_entails_A	a light brown dog is running in the water	a light brown dog is running in the water	FLICKR	FLICKR	TRAIN	2270483627_16fe41b063.jpg#1
2076	8536	S1S2_inter	A light brown dog is running in the water	S1_null	A tan dog is playing in the water on the bank of a pond	S2_null	4.0	NEUTRAL	A_neutral_B	B_neutral_A	a light brown dog is running in the water	a tan dog splashing in water on the bank of a pond or river	FLICKR	FLICKR	TRAIN	2270483627_16fe41b063.jpg#1
2077	8537	S1S3_inter	A light brown dog is running in the water	S1_null	A tan dog is splashing in the water on the bank of a river	S3_null	3.9	NEUTRAL	A_neutral_B	B_neutral_A	a light brown dog is running in the water	a tan dog splashing in water on the bank of a pond or river	FLICKR	FLICKR	TRAIN	2270483627_16fe41b063.jpg#1
2081	8538	S1S2_inter	A tan dog is splashing in the water on the bank of a pond	S1_null	A light brown dog is sprinting in the water	S2_null	2.9	NEUTRAL	A_neutral_B	B_neutral_A	a tan dog splashing in water on the bank of a pond or river	a light brown dog is running in the water	FLICKR	FLICKR	TRAIN	2270483627_16fe41b063.jpg#3
2083	8541	S1S2_intra	The child is splashing water in a small blue pool	S1_null	The child is splashing water in a pool	S2_aa	4.5	ENTAILMENT	A_entails_B	B_neutral_A	the child is splashing water in a small blue pool	the child is splashing water in a small blue pool	FLICKR	FLICKR	TRAIN	539751252_2bd88c456b.jpg#4
2093	8567	S1S1_inter	A man in a hat is standing outside of a green jeep	S1_null	A man is standing on a dirt hill next to a black jeep	S1_null	3.4	NEUTRAL	A_neutral_B	B_neutral_A	man standing on a dirt hill next to a black jeep	a man in in a hat standing outside of his green jeep rangler	FLICKR	FLICKR	TRAIN	190638179_be9da86589.jpg#4
2095	8569	S1S3_intra	A black dog and a small white and black dog are looking up at a kitchen countertop	S1_null	A black cat and a small white and black cat are looking up at a kitchen countertop	S3_so	2.2	NEUTRAL	A_neutral_B	B_neutral_A	a black dog and small white and black dog look up at a kitchen countertop	a black dog and small white and black dog look up at a kitchen countertop	FLICKR	FLICKR	TRAIN	3204525212_d548c7fca7.jpg#0
2096	8572	S1S2_inter	A black dog and a small white and black dog are looking up at a kitchen countertop	S1_null	A large dog and a small dog are standing next to the kitchen counter and are sniffing	S2_null	4.2	NEUTRAL	A_neutral_B	B_neutral_A	a black dog and small white and black dog look up at a kitchen countertop	a large dog and a small dog stand next to the kitchen counter to investigate	FLICKR	FLICKR	TRAIN	3204525212_d548c7fca7.jpg#0
2099	8571	S1S3_intra	A large dog and a small dog are standing next to the kitchen counter and are investigating	S1_null	A large dog and a small dog is standing on the kitchen counter and investigate	S3_so	4.4	ENTAILMENT	A_entails_B	B_contradicts_A	a large dog and a small dog stand next to the kitchen counter to investigate	a large dog and a small dog stand next to the kitchen counter to investigate	FLICKR	FLICKR	TRAIN	3204525212_d548c7fca7.jpg#1
2100	8574	S1S2_inter	A large dog and a small dog are standing next to the kitchen counter and are investigating	S1_null	Two dogs are looking up at a kitchen countertop	S2_null	4.3	NEUTRAL	A_neutral_B	B_neutral_A	a large dog and a small dog stand next to the kitchen counter to investigate	a black dog and small white and black dog look up at a kitchen countertop	FLICKR	FLICKR	TRAIN	3204525212_d548c7fca7.jpg#1
2101	8578	S1S3_intra	A dog is rolling on the ground	S1_null	A dog is sleeping on the ground	S3_so	3.8	NEUTRAL	A_neutral_B	B_neutral_A	a dog rolls on the ground	a dog rolls on the ground	FLICKR	FLICKR	TRAIN	2696866120_254a0345bc.jpg#2
2103	8584	S1S3_inter	A dirty tan dog is rolling in the dirt and looking right at the camera	S1_null	A dog is sleeping on the ground	S3_null	3.1	NEUTRAL	A_neutral_B	B_neutral_A	a dirty tan dog rolling in the dirt and looking right at the camera	a dog rolls on the ground	FLICKR	FLICKR	TRAIN	2696866120_254a0345bc.jpg#0
2105	8586	S1S2_intra	An Arabic man is wearing a white hat	S1_null	A white hat is being worn by an Arabic man	S2_top	4.9	ENTAILMENT	A_entails_B	B_entails_A	an arabic man in a white hat	an arabic man in a white hat	FLICKR	FLICKR	TRAIN	3173157541_70b16b4318.jpg#3
2106	8590	S1S2_inter	An Arabic man is wearing a white hat	S1_null	A man with a white hat and brown shirt is behind a woman in red and is looking to the side	S2_null	2.6	NEUTRAL	A_neutral_B	B_neutral_A	an arabic man in a white hat	a man with a white hat and brown shirt, behind a woman in red, looks to the left	FLICKR	FLICKR	TRAIN	3173157541_70b16b4318.jpg#3
2107	8594	S1S1_inter	A man with a white hat and brown shirt is behind a woman in red and is looking to the left	S1_null	An Arabic man is wearing a white hat	S1_null	2.4	NEUTRAL	A_neutral_B	B_neutral_A	an arabic man in a white hat	a man with a white hat and brown shirt, behind a woman in red, looks to the left	FLICKR	FLICKR	TRAIN	3173157541_70b16b4318.jpg#3
2108	8588	S1S2_intra	A man with a white hat and brown shirt is behind a woman in red and is looking to the left	S1_null	A man with a white hat and brown shirt is behind a woman in red and is looking to the side	S2_lex	4.5	ENTAILMENT	A_entails_B	B_neutral_A	a man with a white hat and brown shirt, behind a woman in red, looks to the left	a man with a white hat and brown shirt, behind a woman in red, looks to the left	FLICKR	FLICKR	TRAIN	3173157541_70b16b4318.jpg#1
2109	8596	S1S3_intra	Little kids are playing in a water fountain in front of lots of people	S1_null	Little kids are playing in a water fountain in front of few people	S3_so	4.1	NEUTRAL	A_neutral_B	B_contradicts_A	little kids are playing in a water fountain in front of lots of people	little kids are playing in a water fountain in front of lots of people	FLICKR	FLICKR	TRAIN	720208977_f44c2bba5b.jpg#3
2110	8600	S1S3_inter	Little kids are playing in a water fountain in front of lots of people	S1_null	Animals are playing in fountains that spray water from the ground	S3_null	2.9	NEUTRAL	A_neutral_B	B_neutral_A	little kids are playing in a water fountain in front of lots of people	children play in fountains that spray water from the ground	FLICKR	FLICKR	TRAIN	720208977_f44c2bba5b.jpg#3
2112	8597	S1S2_intra	Children are playing in a fountain that is spraying water from the ground	S1_null	Children are playing in ground fountains	S2_lex	4.3	ENTAILMENT	A_entails_B	B_neutral_A	children play in fountains that spray water from the ground	children play in fountains that spray water from the ground	FLICKR	FLICKR	TRAIN	720208977_f44c2bba5b.jpg#1
2113	8598	S1S3_intra	Children are playing in a fountain that is spraying water from the ground	S1_null	Animals are playing in fountains that spray water from the ground	S3_so	3.35	NEUTRAL	A_neutral_B	B_neutral_A	children play in fountains that spray water from the ground	children play in fountains that spray water from the ground	FLICKR	FLICKR	TRAIN	720208977_f44c2bba5b.jpg#1
2116	8607	S1S3_intra	A cyclist on a yellow bike is airborne	S1_null	There is no cyclist on a yellow bike airborne	S3_od	3.9	CONTRADICTION	A_contradicts_B	B_contradicts_A	a cyclist on a neon yellow bike is airborne	a cyclist on a neon yellow bike is airborne	FLICKR	FLICKR	TRAIN	640053014_549d2f23d2.jpg#0
2117	8614	S1S3_intra	A man is wearing a beret and is riding the bicycle on a recreation trail	S1_null	A woman is wearing a beret and is riding the bicycle on a recreation trail	S3_so	3.4	NEUTRAL	A_neutral_B	B_neutral_A	a man wearing a beret rides his bicycle on a recreation trail	a man wearing a beret rides his bicycle on a recreation trail	FLICKR	FLICKR	TRAIN	2075321027_c8fcbaf581.jpg#1
2118	8618	S1S3_inter	A man is wearing a beret and is riding the bicycle on a recreation trail	S1_null	An old man with a grey beard is not riding a bike	S3_null	2.365	NEUTRAL	A_neutral_B	B_neutral_A	a man wearing a beret rides his bicycle on a recreation trail	an old man, with a grey beard, riding his bike	FLICKR	FLICKR	TRAIN	2075321027_c8fcbaf581.jpg#1
2122	8622	S1S2_intra	Five adults are sitting on stone steps	S1_null	Five adults are sitting on steps made of stone	S2_expa	4.9	ENTAILMENT	A_entails_B	B_entails_A	five adults are sitting on stone steps	five adults are sitting on stone steps	FLICKR	FLICKR	TRAIN	1763020597_d4cc8f0f8a.jpg#3
2124	8626	S1S2_inter	Five adults are sitting on stone steps	S1_null	People are sitting near a wall	S2_null	3.0	NEUTRAL	A_neutral_B	B_neutral_A	five adults are sitting on stone steps	people sit against a.wall	FLICKR	FLICKR	TRAIN	1763020597_d4cc8f0f8a.jpg#3
2125	8627	S1S3_inter	Five adults are sitting on stone steps	S1_null	People is standing against a wall	S3_null	1.8	NEUTRAL	A_neutral_B	B_neutral_A	five adults are sitting on stone steps	people sit against a.wall	FLICKR	FLICKR	TRAIN	1763020597_d4cc8f0f8a.jpg#3
2126	8630	S1S1_inter	People are sitting against a wall	S1_null	Five adults are sitting on stone steps	S1_null	3.2	NEUTRAL	A_neutral_B	B_neutral_A	five adults are sitting on stone steps	people sit against a.wall	FLICKR	FLICKR	TRAIN	1763020597_d4cc8f0f8a.jpg#3
2127	8624	S1S2_intra	People are sitting against a wall	S1_null	People are sitting near a wall	S2_lex	4.1	ENTAILMENT	A_entails_B	B_neutral_A	people sit against a.wall	people sit against a.wall	FLICKR	FLICKR	TRAIN	1763020597_d4cc8f0f8a.jpg#0
2130	8631	S1S2_intra	A man is rock climbing and a city and a bay are in the background	S1_null	A person is rock climbing and a city and a bay are in the background	S2_lex	4.4	ENTAILMENT	A_entails_B	B_neutral_A	a man rock climbing, with a city and a bay in the background	a man rock climbing, with a city and a bay in the background	FLICKR	FLICKR	TRAIN	140526327_3cb984de09.jpg#3
2131	8639	S1S1_inter	A man is rock climbing, pausing and calculating the route	S1_null	A man is rock climbing and a city and a bay are in the background	S1_null	3.3	NEUTRAL	A_neutral_B	B_neutral_A	a man rock climbing, with a city and a bay in the background	a man rock climbing pauses to calculate his route	FLICKR	FLICKR	TRAIN	140526327_3cb984de09.jpg#3
2134	8637	S1S2_inter	A man is rock climbing, pausing and calculating the route	S1_null	A person is rock climbing and a city and a bay are in the background	S2_null	3.55	NEUTRAL	A_neutral_B	B_neutral_A	a man rock climbing pauses to calculate his route	a man rock climbing, with a city and a bay in the background	FLICKR	FLICKR	TRAIN	140526327_3cb984de09.jpg#2
2136	8647	S1S4_inter	A little girl in a pink shirt is playing t-ball and taking a swing	S1_null	A girl is hitting a little tee with a baseball	S4_null	3.3	NEUTRAL	A_neutral_B	B_neutral_A	a little girl in a pink shirt takes a swing at a t-ball	a little girl about to hit a baseball off a tee	FLICKR	FLICKR	TRAIN	3631671718_d712821757.jpg#2
2139	8649	S1S3_inter	A little girl is hitting a baseball off a tee	S1_null	A little boy in a pink shirt is playing t-ball and taking a swing	S3_null	3.3	NEUTRAL	A_neutral_B	B_neutral_A	a little girl about to hit a baseball off a tee	a little girl in a pink shirt takes a swing at a t-ball	FLICKR	FLICKR	TRAIN	3631671718_d712821757.jpg#1
2141	8656	S1S3_inter	A group of people is gathering at a stand at the fair	S1_null	The people are running at a carnival	S3_null	2.8	NEUTRAL	A_neutral_B	B_neutral_A	a group of people gather at a stand at the fair	the people are standing around at a carnival	FLICKR	FLICKR	TRAIN	3409947123_a8d07edecf.jpg#1
2147	8668	S1S1_inter	Rollerbladers are rolling in formation down a hill	S1_null	A group of rollerbladers is lining up on the street	S1_null	3.4	NEUTRAL	A_neutral_B	B_neutral_A	a group of roller bladers is lined up on the street	rollerbladers roll in formation down a hill	FLICKR	FLICKR	TRAIN	3500136982_bf7a85531e.jpg#0
2149	8663	S1S3_intra	Rollerbladers are rolling in formation down a hill	S1_null	Rollerbladers are not rolling in formation down a hill	S3_inv	4.3	CONTRADICTION	A_contradicts_B	B_contradicts_A	rollerbladers roll in formation down a hill	rollerbladers roll in formation down a hill	FLICKR	FLICKR	TRAIN	3500136982_bf7a85531e.jpg#4
2150	8669	S1S2_intra	A woman is marching with a pair of dogs	S1_null	A woman is walking with a pair of dogs	S2_lex	4.4	ENTAILMENT	A_entails_B	B_neutral_A	a woman marches with a pair of dogs	a woman marches with a pair of dogs	FLICKR	FLICKR	TRAIN	2616673985_fa4354cc53.jpg#2
2151	8674	S1S3_inter	A woman is marching with a pair of dogs	S1_null	A woman is showing a dog with very short hair at a dog show	S3_null	2.4	NEUTRAL	A_neutral_B	B_neutral_A	a woman marches with a pair of dogs	a woman shows a dog with very long hair at a dog show	FLICKR	FLICKR	TRAIN	2616673985_fa4354cc53.jpg#2
2154	8679	S1S3_intra	A skateboarder is making a jump off a ramp	S1_null	No skateboarder is making a jump off a ramp	S3_od	3.3	CONTRADICTION	A_contradicts_B	B_contradicts_A	a skateboarder makes a jump off a ramp	a skateboarder makes a jump off a ramp	FLICKR	FLICKR	TRAIN	3323988406_e3c8fce690.jpg#3
2155	8683	S1S3_inter	A skateboarder is making a jump off a ramp	S1_null	A woman dressed in black is wearing inline skates and performing a trick on a rail	S3_null	3.0	NEUTRAL	A_neutral_B	B_neutral_A	a skateboarder makes a jump off a ramp	a man dressed all in black performs a trick on a rail while wearing inline skates	FLICKR	FLICKR	TRAIN	3323988406_e3c8fce690.jpg#3
2156	8686	S1S1_inter	A man dressed in black is wearing inline skates and performing a trick on a rail	S1_null	A skateboarder is making a jump off a ramp	S1_null	2.4	NEUTRAL	A_neutral_B	B_neutral_A	a skateboarder makes a jump off a ramp	a man dressed all in black performs a trick on a rail while wearing inline skates	FLICKR	FLICKR	TRAIN	3323988406_e3c8fce690.jpg#3
2158	8684	S1S2_inter	A man dressed in black is wearing inline skates and performing a trick on a rail	S1_null	A skateboarder is jumping off a ramp	S2_null	3.0	NEUTRAL	A_neutral_B	B_neutral_A	a man dressed all in black performs a trick on a rail while wearing inline skates	a skateboarder makes a jump off a ramp	FLICKR	FLICKR	TRAIN	3323988406_e3c8fce690.jpg#1
2161	8692	S1S3_inter	Three children are running down hill	S1_null	Three children are running up a grassy hillside	S3_null	3.8	NEUTRAL	A_neutral_B	B_neutral_A	three children running down hill	three children running down a grassy hillside	FLICKR	FLICKR	TRAIN	775664534_3f6de7d413.jpg#4
2163	8689	S1S2_intra	Three children are running down a grassy hillside	S1_null	Three children are running down a hillside covered by grass	S2_expa	4.9	ENTAILMENT	A_entails_B	B_entails_A	three children running down a grassy hillside	three children running down a grassy hillside	FLICKR	FLICKR	TRAIN	775664534_3f6de7d413.jpg#3
2165	8697	S1S3_intra	A black and orange bird is standing in the grass	S1_null	A black and orange bird is not standing in the grass	S3_inv	3.4	CONTRADICTION	A_contradicts_B	B_contradicts_A	a black and orange bird in the grass	a black and orange bird in the grass	FLICKR	FLICKR	TRAIN	3547600292_6f8aac7f2e.jpg#2
2169	8705	S1S2_intra	A shirtless man is posing with a girl who is hiking in a park	S1_null	A shirtless person is posing with a girl who is hiking in a park	S2_lex	4.6	ENTAILMENT	A_entails_B	B_entails_A	a shirtless man poses with a girl hiking in a park	a shirtless man poses with a girl hiking in a park	FLICKR	FLICKR	TRAIN	2696951725_e0ae54f6da.jpg#4
2171	8709	S1S2_inter	A shirtless man is posing with a girl who is hiking in a park	S1_null	A man without a shirt is posing with the arms spread near a woman	S2_null	4.1	ENTAILMENT	A_entails_B	B_neutral_A	a shirtless man poses with a girl hiking in a park	a man without a shirt poses with his arms spread next to a woman	FLICKR	FLICKR	TRAIN	2696951725_e0ae54f6da.jpg#4
2175	8712	S1S3_inter	A man without a shirt is posing with the arms spread next to a woman	S1_null	A shirtless woman is posing with a girl who is hiking in a park	S3_null	2.9	NEUTRAL	A_neutral_B	B_neutral_A	a man without a shirt poses with his arms spread next to a woman	a shirtless man poses with a girl hiking in a park	FLICKR	FLICKR	TRAIN	2696951725_e0ae54f6da.jpg#3
2176	8716	S1S2_intra	Two white puppies are playing near a pool	S1_null	Two white puppies are playing near water	S2_lex	4.4	ENTAILMENT	A_entails_B	B_neutral_A	two white puppies play near a pool	two white puppies play near a pool	FLICKR	FLICKR	TRAIN	2275029674_6d4891c20e.jpg#4
2179	8719	S1S3_inter	Two white dogs are running together	S1_null	Two black puppies are playing near a pool	S3_null	1.6	NEUTRAL	A_neutral_B	B_neutral_A	two white dogs are running together	two white puppies play near a pool	FLICKR	FLICKR	TRAIN	2275029674_6d4891c20e.jpg#3
2183	8728	S1S3_inter	A group of people are standing around a sound mixing table	S1_null	A group of people are not looking at sound equipment	S3_null	3.7	NEUTRAL	A_neutral_B	B_contradicts_A	a group of people are standing around a sound mixing table	a group of people looking at sound equipment	FLICKR	FLICKR	TRAIN	3042380610_c5ea61eef8.jpg#0
2193	8739	S1S3_inter	A young couple is lying on a bed together	S1_null	A young couple is not lying in bed	S3_null	3.7	CONTRADICTION	A_contradicts_B	B_contradicts_A	a young couple lying on a bed together	a young couple lying in bed	FLICKR	FLICKR	TRAIN	2922981282_203f04bf9b.jpg#1
